"No","Title","Url","date_published","author","content"
"48","New Bedford vertical farm to help food security - minister","https://www.bbc.com/news/uk-england-beds-bucks-herts-61954771","Tuesday, June 28, 2022","BBC Author","An agriculture minister said she expected indoor farms to ""play a large part in the future"" of farming.

Jo Churchill MP made the comment at the opening of a vertical farm in Bedford, which is one of the largest in Europe.

The facility - Infarm - which measures 10,000 sq m (2.5 acres) in size, has the capacity to grow millions of crops each year in tall units without soil.

The company said the farm used 95% less water than traditional farming methods and no chemical pesticides.

Ms Churchill, Conservative MP for Bury St Edmunds in Suffolk, said indoor farms, growing food using the hydroponic method, would play an important role in helping UK food security and sustainability.

Under the method, plants are fed directly with mineral nutrients in water, often under artificial light.

The minister for Agri-Innovation and Climate Adaptation, said: ""This is innovation, we have the traditional but we also have this high-tech development.

""The world needs food, so actually finding better and diverse ways to deliver that, both to the customer, there is space for everybody to produce optimally.

""This is definitely going to play a large part in the future."" The Bedford site is Infarm's first high-capacity growing centre in the UK and can feature up to 40 cloud-connected farming units, each standing 10 metres high.

Each unit can grow more than 500,000 plants per year - the equivalent of a football field worth of crops.

Ms Churchill said she expected this method of farming to generate more jobs for young people, especially in the areas of robotics, artificial intelligence and plant breeding.

Bedford MP Mohammad Yasin, Labour, said the venture would create between 50 and 70 new jobs.

""The UK is overly dependent on food imports leaving us dangerously exposed to food insecurity and soaring food prices,"" he said.  ""I'm really excited that Bedford is now home to one of Europe's largest vertical farming facilities at the forefront of new ways to grow more food domestically."" Infarm said an estimated 2.5 million litres of rainwater would be captured and used in its Bedford farm.

Water which evaporates from plants would also be recycled back into the system.

Types of produce grown this way included herbs, leafy greens, salads, microgreens, and mushrooms.  Strawberries, peppers, cherry tomatoes and peas would also be grown going forward, the firm said.

""Every vertical farm is connected to a central farming brain which gathers data constantly to improve plant yield, taste and nutritional value, while further reducing the use of natural resources,"" said Infarm.

Erez Galonska, co-founder of Infarm, said: ""The opening of this UK facility is aligned with our goal to change the food system for the better by improving the safety, quality and environmental footprint of our food.""

The Bedford farm said it planned to install solar panels to provide renewable energy.

""By the end of 2022 we aim to procure close to 100% green-certified, renewable and low-carbon sources of electricity across our network,"" it said. "
"49","Farmers warned of Brexit no-deal 'turbulence'","https://www.bbc.com/news/uk-politics-46743164","Thursday, January 03, 2019","BBC Author","Farmers and food producers face ""considerable turbulence"" if the UK leaves the EU with no deal, Environment Secretary Michael Gove has said.

He told the Oxford Farming Conference it was a ""grim and inescapable fact"" there would be tariffs on exports and new sanitary and other border checks.

While ""not perfect"", he said Theresa May's Brexit deal would protect market access and provide economic certainty.

But Labour said ""basic legislation"" was not in place to prepare for Brexit.

And environmental campaigners said Mr Gove should set up an independent regulator to ensure that minimum standards to protect water, soil, wildlife and animal welfare are maintained.      Farmers seek food standards law after Brexit
    Brexit ferry firm in terms gaffe
    Brexit: A really simple guide

The UK is scheduled to leave the EU on 29 March, with MPs due to vote in the Commons in mid-January on the prime minister's withdrawal deal.

Urging MPs to support the PM's deal, Mr Gove said it would ensure the UK left the Common Agricultural Policy but, at the same time, provide a smooth transition period for agriculture and guarantee continuous tariff-free and quota-free access to EU markets.

From 2021, he said, the UK would be able to ""largely diverge from EU regulation"", enabling it to pursue its land management priorities and invest in technology which the EU has ""turned its back on"".

""All of these are real gains that our departure from the EU can bring, but these real gains risk being undermined if we leave the EU without a deal,"" he said. Mr Gove, a leading figure in the 2016 Leave campaign, rejected suggestions that warnings about the economic impact of a no-deal exit were being over-stated and another example of ""Project Fear"".

""No-one can be blithe or blase about the real impact on food producers in this country of leaving without a deal,"" he said.

    Gove sets out post-Brexit farm funding
    New EU fishing rules 'could hurt UK industry'

It was a ""grim and inescapable fact"", he said, that beef and lamb exports could face export tariffs of at least 40% if the UK defaulted to World Trade Organization rules, while standard tariffs of 11% could be levied on a host of agricultural products. ""The combination of significant tariffs, where none exist now, friction and checks at the border, where none exist now, and the requirements to re-route or pay more for transport when current arrangements are frictionless, will all add to costs for producers,"" he said. The government has guaranteed to pay subsidies to farmers at current EU levels until 2022.

After that there will be a ""transitional period"" in England, with an increasing link between funds and maintaining ""public goods"", such as access to the countryside and planting meadows.

Mr Gove said these commitments offered farmers greater certainty than their EU competitors.  'Fantasy deal'

But Conservative former minister Guto Bebb, who backs another Brexit referendum, said the proposed deal would leave ""all the big questions unanswered"".

""There is no kind of fantasy Brexit deal that can meet all the promises made to farmers or the rural economy,"" he said.

And Labour said Mr Gove's vision for the future of farming was ""irrelevant while basic legislation is not even in place and there are serious concerns about Defra's preparedness for a no-deal scenario that would be devastating for farmers"".

The National Farmers Union said an ""orderly"" Brexit was vital for the industry's future prosperity and to fail to deliver that would be ""catastrophic"".

""That's primarily because a lot of our input, 90% of our animal medicines and vaccines, chemicals and fertilisers, are produced in the EU,"" its president Minette Batters said. ""We don't make those kind of things in the UK any more.""

In his speech, Mr Gove insisted maintaining animal welfare and food safety was critical to the industry's reputation and sustainability and the UK ""must not barter them away in a short-term trade off"".

The NFU is calling for ""more than warm words"" on the issue, with specific legislation to ensure the same standards are applied to imported food as home-grown produce."
"50","Climate change: UK government to commit to 2050 target","https://www.bbc.com/news/science-environment-48596775","Wednesday, June 12, 2019","Roger Harrabin","Greenhouse gas emissions in the UK will be cut to almost zero by 2050, under the terms of a new government plan to tackle climate change.

Prime Minister Theresa May said there was a ""moral duty to leave this world in a better condition than what we inherited"".

Cutting emissions would benefit public health and cut NHS costs, she said.

Britain is the first major nation to propose this target - and it has been widely praised by green groups.

But some say the phase-out is too late to protect the climate, and others fear that the task is impossible.     Climate change: Where we are in seven charts?
    Will the government pay you to go green?
    What is climate change?
    Is Greta Thunberg right about UK carbon emissions? The UK already has a 2050 target - to reduce emissions by 80%. That was agreed by MPs under the Climate Change Act in 2008, but will now be amended to the new, much tougher, goal.

The actual terminology used by the government is ""net zero"" greenhouse gases by 2050.

That means emissions from homes, transport, farming and industry will have to be avoided completely or - in the most difficult examples - offset by planting trees or sucking CO2 out of the atmosphere. The government's advisory Committee on Climate Change recommended the ""net zero"" target in May.

Its report said if other countries followed the UK, there was a 50-50 chance of staying below the recommended 1.5C temperature rise by 2100.

A 1.5C rise is considered the threshold for dangerous climate change. Laurence Tubiana, an architect of the crucial Paris climate agreement, told the BBC: ""This is a historic commitment that will reverberate right around the world. ""All eyes will now turn on the rest of the EU to match this pledge.""

Theresa May said the UK led the world to wealth through fossil fuels in the industrial revolution, so it was appropriate for Britain to lead in the opposite direction.

""We have made huge progress in growing our economy and the jobs market while slashing emissions,"" she said.

""Now is the time to go further and faster to safeguard the environment for our children. We must lead the world to a cleaner, greener form of growth.""

Number 10 said it was ""imperative"" other countries followed suit, so there would be a review within five years to ensure other nations were taking similarly ambitious action and British industries were not facing unfair competition. Scotland has already committed to reducing greenhouse gas emissions to net-zero by 2045, five years ahead of the UK government's target.

The Committee on Climate Change (CCC) recommended Wales should aim to cut emissions by a lower target of 95% by 2050 due to the importance of the farming industry to rural communities. But the Welsh government has since said it wants to go further - and will commit to net-zero by 2050, like the rest of the UK.

Northern Ireland is the only devolved administration which does not have its own climate change legislation and emissions targets.
How will it affect people?

If ministers decided to clamp down on meat-eating or on flying, that would meet serious opposition.

But the government will attempt to make the clean revolution as painless as possible. Technology improvements like LED light bulbs, for instance, save emissions without people noticing. The same is true if people get hydrogen central heating instead of gas, or if they are obliged to drive electric cars rather than petrol vehicles.

But there will need to be a massive investment in clean energy generation - and that has to be funded by someone.

The government hasn't yet spelled out if the cost will fall on bill-payers, or tax-payers, or the fossil fuel firms that have caused climate change.

And then there's the international dimension. Prof Dieter Helm, from the Blavatnik School of Government at Oxford University, said: ""From the UK's end, doing this unilaterally, we have to be very careful that we don't simply say: 'we're going to reduce the emissions from our cars and our power stations here in Britain, but we're going to carry on importing those emissions from overseas.' ""We don't make very much in this country. Manufacturing is only 20% of the economy. Most of the stuff that you go and buy in the supermarket... it's all imported.""

    What's your diet's carbon footprint?
    What is a climate emergency?
    How can I help?

What will this cost?

Chancellor Philip Hammond has warned of a potential cost of £1 trillion by 2050.

The cash will have to come from somewhere, he said - maybe from schools, hospitals and the police.

However, Chris Skidmore, the acting energy minister, said the costs would amount to between 1 and 2% of the UK's GDP - which was the same amount factored in to reach the previous 80% reduction target. Therefore it would not be the case that there would be less money to spend elsewhere, he said.  He added that the green economy would generate jobs and the cost of green technologies was coming down all the time.

The climate change contrarian Bjorn Lomborg, author of Skeptical Environmentalist, said: ""Mr Hammond is right to highlight the cost - and in fact, he is likely to be underestimating the real price tag.""

Campaigners said Mr Hammond's sums did not take into account the benefits of cleaner air and a more stable climate.
Will the proposal stick?

Following the Committee on Climate Change's recommendations last month, scientists, campaigners and health professionals have been urging Mrs May to bring in a net zero target before she stands down.

The government will lay a ""statutory instrument"" in the Commons on Wednesday - a tactic that allows it to be fast-tracked through both houses of Parliament if other parties agree - which on this issue they generally do. Like any government decision it could be overturned by future governments.

But the majority of Tory leadership candidates are backing it - and revoking the Act would need a majority Commons vote at a time when the public appear very concerned about the climate. Mrs May has taken the unusual step of announcing that a group of young people will advise the government on priorities for environmental action. They will start their review in July.

This is seen as a nod towards young voters, many of whom have recently taken to the streets protesting that their environment was being destroyed. What other problems stand in the way?

The magnitude of the task is clear. The UK is already slipping away from its mid-term carbon targets of cutting emissions by 80% by 2050.

""Achieving net zero greenhouse gas emissions is necessary, feasible and cost-effective,"" said professor Phil Taylor, head of engineering at Newcastle University.

""But UK policy is still way off the mark and the foundations are not in place to be able to meet this target.

""Even with all the evidence before us we are still opening new coal mines, extending Heathrow airport and pushing forward with fracking.

""We have unambitious building regulations, and our drive to phase out petrol and diesel cars by 2040 is too late."" Dr Shaun Fitzgerald, director of the Royal Institution, warned that the public might not support carbon-cutting measures such as turning down thermostats in the home.

And he questioned the ability of the government to insulate enough houses in time. ""The prize for improving the efficiency of buildings is significant,"" he said.

""However, there is a practical challenge in terms of the number of sufficient skilled workers to undertake the work, and then of course the barrier of getting homeowners to get the work done.""

There will be major difficulties, too, in supplying low-carbon heating to homes and industries as natural gas is phased out. Doug Parr, Greenpeace UK's chief scientist, said it was a ""big moment"" for the climate but there were questions around plans to allow for international carbon credits which allow the UK to pay to offset its emissions elsewhere in the world.

Such off-setting had a history of failure, was not cost-efficient and shifting the burden to developing nations undermined the commitment, he told the Guardian.

Chris Skidmore, the acting energy minister, said the government did not ""intend"" to use international carbon credits but had kept it ""as an option"". ""We need to be able to decarbonise in the best possible way so we don't want to rule it out,"" he said.

Mrs May's announcement indicates that she has taken notice of potential industrial pitfalls.

To assuage Treasury fears about competitiveness, she has stipulated that the net zero policy should be reviewed in five years to see whether other nations were taking similar actions."
"51","Gene-edited tomatoes could soon be sold in England","https://www.bbc.com/news/science-environment-61537610","Monday, May 23, 2022","Pallab Ghosh","Tomatoes that boost the body's vitamin D could be among the first gene-edited crops allowed on sale in England.

Researchers in Norwich created the plants by turning off a specific molecule in their genetic code.

A bill will be introduced on Wednesday to allow commercial growing of gene-edited crops in England.

The technique is currently not used for food production in the UK because of rules set by the EU but Brexit has enabled the UK to set its own rules.

One in six people in the UK are deficient in vitamin D, which is vital to strong bones and muscles and helps reduce risk of cancer. Prof Cathie Martin, who led the research at the John Innes Centre, said that the development, published in Nature Plants, could be hugely beneficial.

""With humans, half an hour in the sunshine every day is enough to make enough vitamin D. But a lot of people don't have that time outside and that's why they need supplements. The tomatoes themselves could provide another source of vitamin D in their diet."" If government legislation gets through Parliament successfully, the vitamin-boosting fruits could be among the first gene-edited crops allowed on supermarket shelves in England. Gene editing is a relatively recent technology. It involves switching genes on and off by snipping out a small section of the plant's DNA. The older technique of genetic modification involves putting genes in, sometimes from a completely different species.

EU restrictions mean both methods have been effectively banned in Europe for a quarter century.

Both methods are used in other countries, to produce food. But the EU set stringent regulations on GM crops 25 years ago because of safety concerns and public opposition to the technology. Gene-edited crops are covered by the same regulations.

The UK currently follows European Union regulations on both technologies.

Any new GM or GE crop must undergo a scientific safety assessment, which can take around five years. Plant breeders believe that to be too onerous and expensive and so do not invest in the technology in Europe. In addition, any new variety that passes the EU's safety tests must then be approved by a majority at the European Parliament.  Plant breeders believe that political opposition is too strong for the approval of new GM or GE varieties. The regulations, say the plant industry, effectively prevented the commercial production of GM foods in Europe.

The UK government has decided that gene editing is safe to use and is to introduce a bill on Wednesday to allow its commercial development in England. The regulations on GM crops will not be relaxed at this stage.

The Environment Secretary George Eustice told BBC News that the change in the law was necessary to combat the impact of climate change.

''The reality is we're going to need more drought resistant plants and as we try and reduce the use of chemical pesticides, we need to breed in the natural resistance of plants to diseases and this precision breeding technology gives you the ability to do that; it gives you the ability to change traits in a plant faster than you could by conventional breeding but it's not the same as genetic modification''. The development has been welcomed by Nigel Moore, of KWS, a plant-breeding firm in Hertfordshire which produces wheat and barley.

""With the varieties we see in England, it generally takes us 12 years to produce those new ones. With gene-editing, we can respond to changing farmers' much faster.""

KWS has been developing new varieties of wheat and barley for farmers for 150 years using traditional cross-breeding techniques. Mr Moore says that the firm needs to use gene-editing to produce the new varieties farmers are asking for.

""If we think about the pace of change: climate change, the need to reduce nitrogen fertilizer, need to use less pesticides; the faster we get the genetic changes we need, the faster we are able to adapt to all of that changing world around us"".

Critics of the technology, such as Liz O'Neill, who is the director of the campaign group, GM Freeze, says that the government is being too hasty in lifting restrictions for gene-edited crops. "
"52","The race to make diesel engines run on hydrogen","https://www.bbc.com/news/business-64248564","Friday, January 20, 2023","Phil Mercer","It's a new hydrogen-diesel hybrid engine affectionately known as ""baby number two"" that could help to decarbonise some of Australia's heaviest industries.

The test rig is large - it has its own room adjoining a lab and looks at first glance like many other large motors, but beneath its metallic skin could lie game-changing technology.

Engineers at the University of New South Wales (UNSW) say they have successfully modified a conventional diesel engine to use a mix of hydrogen and a small amount of diesel, claiming their patented technology has cut carbon dioxide (CO2) emissions by more than 85%.

It's the work of Prof Shawn Kook and his team at the university's School of Mechanical and Manufacturing Engineering.

""The interest in converting an existing diesel engine into a clean-burning hydrogen engine is extremely high,"" Prof Kook tells the BBC at his laboratory in Sydney. Enquiries have come from Germany, South Africa, Brazil, Japan and China. ""We mount the hydrogen direct injection system into existing diesel engines, which can be applied to any conventional engine,"" he adds.

What makes their system unique, according to Prof Kook, is the way it mixes the hydrogen and diesel and then introduces it to the engine cylinder for combustion.  Unlike fossil fuels, hydrogen does not produce CO2 when burnt, so it has long been seen as a greener fuel source.

About 90% of fuel in the UNSW hybrid diesel engine is hydrogen but it must be applied in a carefully calibrated way.

If the hydrogen is not introduced into the fuel mix at the right moment ""it will create something that is explosive that will burn out the whole system,"" Prof Kook explains.

He says that studies have shown that controlling the mixture of hydrogen and air inside the cylinder of the engine can help negate harmful nitrogen oxide emissions, which have been an obstacle to the commercialisation of hydrogen motors.

The Sydney research team believes that any diesel trucks and power equipment in the mining, transportation and agriculture sectors could be retrofitted with the new hybrid system in just a couple of months.

Prof Kook doubts the hybrid would be of much interest in the car industry though, where electric and hybrid vehicles are already advanced and replacing diesel cars.

However, he says Australia's multibillion-dollar mining industry needs a solution for all its diesel-powered equipment as soon as possible. ""We have so many established diesel-powered generators, mega-trucks and underground machines. How do we decarbonise all those existing diesel engines? One way is to shut down everything and get new technology in, which will take decades,"" he says.

The plan is for the hybrid to run off a hydrogen-diesel mix or, in the absence of hydrogen, it can revert to diesel only.

Prof Kook hopes his new generation engine will become a commercial product within two years.

Tim Buckley, the director at Climate Energy Finance, a public interest think-tank in Sydney, believes the technology has the potential to ""transform the Australian mining industry dramatically"". ""There's always an element of scepticism in the work I do to evaluate what is hype and hope as opposed to reality. Having said that, this University of New South Wales breakthrough does appear to be pretty material. If they can pull it off it is a huge opportunity,"" he says. "
