"No","Title","Url","date_published","author","content"
"65","Artificial intelligence to help farmers see cloud-covered fields","https://www.bbc.com/news/science-environment-60513742","Friday, February 25, 2022","Jonathan Amos","A Cornish start-up has developed a technique using artificial intelligence to predict what the surface of the UK looks like under gloomy skies.

The satellite technology is being targeted at the agricultural sector to help farmers better manage their crops.

Cloud too often prevents them from seeing the ground to know where and when to sow seed or apply fertiliser.

Aspia Space's technology can produce a clear synthetic image of fields in all weathers.

The Penryn-based company is one of a cluster of operators hoping to benefit from the new space economy being built around Spaceport Cornwall, which is due to start launching rockets from Newquay this summer. The video at the top of this page shows a before-and-after example of what a typical view of the South West can look like on a grey day, followed by what it would be expected to look like if there were clear skies. Aspia's patented algorithm relies on two types on satellite.

One of them is the European Union's workhorse Sentinel-2 spacecraft, which views the ground at so-called optical wavelengths - the type of light to which our eyes are also sensitive. Its pictures are intuitive and easy to analyse - unless the ground is smothered by cloud, which in the UK is a frequent occurrence.

But another EU satellite, Sentinel-1, uses radar to map the ground. Its microwave emission has no problem piercing cloud. Indeed, Sentinel-1 will even see the surface in darkness, at night.

The difficulty with this type of observation, however, is that it is very technical and requires real skill and expertise to interpret. So Aspia has trained its algorithm to interpret the radar reflections and turn them into a synthetic optical image. This means that for a farmer wanting to assess their crop performance this year, instead of getting just a handful of cloud-free Sentinel-2 pictures of their fields through the growing season, they can now have a Sentinel-2-like image every time the radar satellite comes overhead.

In the UK, this might be a couple of times a week.

""To be clear, what you're seeing is a prediction,"" explains Aspia co-founder Jim Geach, who's an astrophysicist at Hertfordshire University.

""What we do is we just mimic all of the Sentinel-2 bands (colours). And then you can use those in exactly the same way you would if you had the real imagery."" The algorithm has been developed with support from the Science and Technology Facilities Council and AeroSpace Cornwall, a research, innovation and development fund.

Aspia is now working with potential clients to see how the approach could work for them.

Geoff Smith is an Earth observation consultant and heavy user of Sentinel-2 imagery. He's intrigued by the proposition but needs convincing that the two different types of satellite observations can be usefully linked in this way.

""Optical and shortwave infrared are related to colour, pigments, chemical composition etc, while microwaves are related to surface roughness and structure. For instance, a field of wheat will change colour as it matures ready for harvest, but its structure and roughness will remain the same,"" he told BBC News. Aspia's Jim Geach says the reactions he's had so far have been very encouraging, and believes the algorithm will open up the six-year archive of cloudy Sentinel-2 imagery to all kinds of new analysis, from mapping trends in drought to tracking the extent of frost and snow cover.

""We have a way of identifying flood risk at a highly granular scale, because you can go back through the entire archive and ask: What fraction of time was a given pixel ever saturated by water? And, of course, that's a map that's going to be changing over time as the climate changes,"" he explained.

And this is not just a technique for the UK, it can be applied anywhere in the world where the Sentinel pair of satellites are collecting data.

Cornwall itself is busy preparing for its maiden rocket mission this summer.

The county's spaceport, based at Newquay airport, will be an international base for entrepreneur Sir Richard Branson's Virgin Orbit company. It uses a repurposed Virgin Atlantic jumbo to launch rockets out over the ocean.

On Thursday, Business Secretary Kwasi Kwarteng, together with the head of Spaceport Cornwall, Melissa Thorpe, ""cut turf"" on a new Centre for Space Technologies.

The centre will act as a facility to prepare satellites for flight, as well as a research and development hub for small space companies in the region.

Mr Kwarteng said: ""Cornwall is leading some of the most significant innovations currently taking place in the space sector. Not only can it claim the world's most capable satellite ground station, Earth observation facilities, and a dedicated horizontal launch site, but it is set to make history later this year by becoming home to the first UK satellite launch."" "
"66","UK-based sat-nav trial to augment GPS performance","https://www.bbc.com/news/science-environment-61723805","Wednesday, June 08, 2022","Jonathan Amos","London satellite company Inmarsat is testing an overlay system to improve the performance of GPS signals received in the UK.

Britain's withdrawal from the European Union means it is no longer involved in the bloc's Galileo sat-nav system, nor its augmentation service called Egnos.

Overlay systems can reduce the errors in standard sat-nav fixes from metres down to just centimetres.

They're particularly useful in giving planes additional assurance in landing.

This is especially so in bad weather. But in the future, they're likely to play an increasing role across the transport sector as vehicles become more automated. Driverless trains, boats, trucks, buses and cars will be big beneficiaries.

Agriculture is becoming a major user, too, ensuring tractors know precisely where in a field to drill seed or apply fertiliser.

""An autonomous platform cannot know where it is to 25m (82ft); it's got to know at the very least where it is to just centimetres,"" said Todd McDonell, president, global government at Inmarsat.

""People seem to think this is only about aviation, and that's an obvious need, but land-based transportation, the maritime sector and agriculture have important needs as well,"" he told BBC News. Inmarsat's system is in a trial phase at the moment. It's using an ageing satellite positioned out over the Atlantic to transmit the assurance data.

British partners on the project include Goonhilly Earth Station Limited in Cornwall and GMV NSL, which specialises in developing positioning, navigation and timing (PNT) technologies.

Augmentation systems are just that - they enhance the basic service by checking the accuracy of signals and warning users if there are issues of concern. But they are not a replacement for the underlying service.

The EU's Egnos system is dependent on Galileo and GPS. If they go down, Egnos has nothing to correct. Likewise for the UKSBAS - the UK Space-Based Augmentation System - and its use of GPS.

Nonetheless, such programmes are proving popular around the world.

America, China, Russia, Japan and India all run augmentation systems. And Inmarsat has recently become involved in a project to develop one for Australia and New Zealand. ""This has industrial base opportunity,"" Mr McDonell said.

""If the UK could create a sovereign service that produces certain benefits to the UK, to its economy, agriculture, transport and so on - then there's an opportunity in terms of developing receivers or other applications or technologies, not just for use in the UK but for export as well."" The future of PNT is moving increasingly towards a ""system of systems"" approach. That's in part because the likes of GPS and Galileo don't work everywhere (in buildings and in tunnels), but also because there's a concern modern economies have become a little too reliant on satellite-navigation signals.

The use of space-borne positioning and timing data is now ubiquitous, in everything from freight movement to the synchronisation of computer networks.  Without the resilience that comes with a diverse set of overlapping types of technology, economies run the risk of damaging shocks if they don't operate back-ups.

Since leaving the 27-member state European Union, the UK has been looking for possible alternatives to Galileo through its Space-Based Positioning Navigation and Timing Programme.

In addition to an augmentation service, the initiative could also lead to a constellation that provides primary PNT signals. Payloads to do this might eventually launch on satellites that are integrated into the OneWeb space-based internet broadband network, which the UK government helped buy out of bankruptcy in 2020.

Paul Bate, chief executive of the UK Space Agency, said: ""Congratulations to Inmarsat, Goonhilly and GMV NSL on this impressive achievement.

""In recent years, the UK Space Agency has invested in the development of UK expertise in Positioning, Navigation and Timing, and the government's commitment to strengthening PNT resilience is set out in both the National Space Strategy and Integrated Review, given its importance to our critical national infrastructure and economy."" The UKSBAS signals being broadcast from the Inmarsat spacecraft in a geostationary slot at 53 degrees West has been constructed in co-operation with the US Federal Aviation Administration, the European Space Agency and the European Union Space Programme Agency to ensure there is no interference with American and European services."
"67","Wales' natural resources used at 'unsustainable rate'","https://www.bbc.com/news/uk-wales-55814191","Wednesday, January 27, 2021","Steffan Messenger","Wales is using up its natural resources at an ""unsustainable rate"" and is yet to meet any of the long-term aims it has set to tackle the issue, its environment watchdog has said.

Natural Resources Wales (NRW) said a ""transformation"" of the food, energy and transport systems was needed.

It warned time was running out to ""avoid a catastrophic situation for Wales and the world"".

The Welsh Government said all of society had a part to play.

By law, NRW has to produce an assessment of the country's natural resources every five years including everything from clean air and water to soil, rocks, minerals and habitats for wildlife.  Its latest report makes for ""bleak reading"", according to Future Generations Commissioner Sophie Howe.

Due to the pandemic it is being published in a phased way - with key headlines and recommendations now.

There will be more detail about the state of each of Wales' ecosystems from our coastline and seas, to rivers, woods and farmland, in March.
What is happening to the environment?

Very few of the habitats wildlife rely on in Wales are in good condition - even in areas where there is meant to be more protection, the report says. Take rivers for example - more than 60% of all river Special Areas of Conservation were found to be failing targets around phosphate pollution - which can be washed in from farmland or sewers.

Just 31% of the country is considered to be semi-natural habitat - and at least 40% of this is spread out in such small patches it is not seen as ""resilient"" enough. Wildlife needs these areas to be joined up if it is to thrive - but this connectivity is also being lost.

It means several iconic species such as the curlew are at risk of extinction from the Welsh countryside within the next 20 years. The situation is also threatening people's lives with poor air quality estimated to cause up to 2,000 deaths annually in Wales, 6% of the total number.

And 245,000 Welsh properties are at risk of flooding - a problem likely to get worse as a result of climate change.

The report concludes not one of four long-term aims NRW set in 2016 to measure progress towards achieving sustainable management of natural resources has been met.

But it said this was not surprising in just a few years, and the problems were not unique to Wales.
How can things be turned around?

Wales needs to ""trial ideas, launch experiments and support innovation"", and urgently transform three key areas of the economy, the report says.

They are the food, energy and transport systems.

It wants to see a lot of work done to encourage lifestyle changes - from what we eat to how we travel.

If everyone on Earth used natural resources at the same rate as Wales, two and a half planets would be needed, it claims. It said the pandemic provided a ""once in a generation opportunity to reset our values and priorities… and create a more sustainable future"".

More technology in agriculture should be used to help cut fertiliser use, prevent pollution and limit the amount of land needed for farming, the report says.

It also suggests there would be a ""positive impact"" from society reducing its consumption of carbon-intensive foods such as meat and dairy.

Dr Hefin Williams, of the Institute of Biological, Environmental and Rural Sciences at Aberystwyth University, said this was ""at its heart a decision for individuals"" and livestock production was ""the backbone of agriculture in Wales"".

While the report outlined the challenges faced by the sector, he said it also highlighted opportunities that the industry here was ""well-placed"" to grasp.

""Increasing use of crops such as white and red clover, peas and other legumes would ultimately allow farmers to have greater control over feed costs [for their animals], cut down on imports and provide environmental benefits by reducing the amount of synthetic fertilisers needed,"" he said."
"68","oronavirus leads to food industry crisis in Europe","https://www.bbc.com/news/world-europe-52715288","Tuesday, May 19, 2020","Eve Webster","Across Europe, much of the food and agriculture industry has been badly affected by the Covid-19 pandemic.

Half of the fishermen in the Netherlands have stopped going out to sea. That's because the price of fresh fish has plummeted due to a lack of demand.

In France, 1,500 tonnes of high quality cheese went off last week, because farmers can’t sell it.

And many of the warehouses that store fresh food across Europe are now reaching capacity."
"69","Mauritania tests drones for desert locust combat","https://www.bbc.com/news/blogs-news-from-elsewhere-51065480","Friday, January 10, 2020","News from Elsewhere","Mauritania is preparing to test drones in the fight against desert locusts as part of efforts by a UN body to minimise the damage inflicted by the pest on crops in West Africa.

Desert locusts pose a serious threat to food security in the region, and the hope is that the aerial tech will provide an advantage in the fight against the insects.

The second round of tests will take place from 26 to 31 January, and is expected to confirm the durability and adaptability of drones in different desert conditions, according to the Sahara Media news agency. ""The drones will track and monitor desert locusts and instigate early-warning operations before the swarms arrive so that appropriate action can be taken,"" according to an ""exclusive"" source.

The latest round of tests, which was officially announced in September 2019, will represent a ""critical stage"" in advancing the fight against the locust plague, Secretary-General of the Mauritanian Rural Development Ministry Ahmedou Ould Bouh said.  Improved technology

The previous tests were conducted in 2018 after the UN Food and Agriculture Organisation (FAO) allocated 1.5 million dollars to the FAO's West Africa joint committee to prevent damaged caused by locusts in the region, according to the then Mauritanian Agriculture Minister, Lemina Mint El-Kotob Ould Momma.

This year's tests are expected to confirm whether improvements made to drones will demonstrate their usability in the harsh desert conditions, and pave the way for their wider use in the region.

It is also hoped that the tests will strengthen the capacity of other countries in West Africa, and improve coordination between them in the fight against the invaders.

FAO's Western Africa joint locust control force was established in 2016 and includes Mauritania, Algeria, Burkina Faso, Morocco, Niger, Senegal, Chad, Libya and Mali.

FAO describes the desert locust, schistocerca gregaria, as the world's ""most dangerous migratory pest, with a voracious appetite unmatched in the insect world"". "
"70","Impossible' not to rely on migrant fruit pickers says Herefordshire farmer","https://www.bbc.com/news/uk-england-hereford-worcester-65607843","Tuesday, May 16, 2023","James Pearson","A call by the home secretary to limit dependence on migrant workers was ""impossible"", a farmer said.

Christine Snell runs a soft fruit farm in Herefordshire and said she was barely able to recruit 10% of the workers it needed during the pandemic.

""Had I relied on them to pick the crops, the crops would have just remained in the field,"" she said.

Suella Braverman said on Monday there was ""no good reason"" the UK could not train its own fruit pickers.

Addressing a conference in London, the home secretary argued there should be training for British fruit pickers, lorry drivers and butchers in a bid to bring down the reliance on migrant workers. Mrs Snell said her farm, Wind Hill, hires about 300 seasonal workers from all over the world each year for six months.

One of her current workers is 25-year-old Nazife Ayrush from Bulgaria who does the job to fund her studies.

""We tried very hard in the pandemic to recruit locally. Out of the 300 we need, we were able to recruit about 35,"" Mrs Snell said.

Of those, many soon left when other opportunities arose, Mrs Snell said. The horticulture industry has suffered labour shortages since the UK left the EU, made worse by the pandemic, and a campaign to recruit more UK-based workers for seasonal farm roles was scrapped in 2021.

A government report in 2022 found British workers were ""not strongly attracted to roles in the food supply chain, particularly seasonal work"".

It highlighted the need for more training and technology to address ""longstanding negative perceptions"" of working in the sector. Ms Braverman said the UK needed to be ""less dependent on low-skilled foreign labour"" but her speech divided politicians. Among those who disagreed with her was the Conservative MP for Wyre Forest, Mark Garnier.

""I don't see why we should be trying to persuade [kids] to do low-productivity, less aspirational jobs like fruit picking when they want to do better things,"" he added.
Fruits growing at Mrs Snell's farm Mr Garnier said it was important to distinguish between migrant workers and other forms of immigration.

""They're not coming in because they're hanging around going on the dole line, they're coming in because we need migrant workers to do the jobs,"" he said. "
"71","Catagen: Belfast 'green-tech' firm plans 100 new jobs","https://www.bbc.com/news/uk-northern-ireland-63680167","Friday, November 18, 2022","John Campbell","The Belfast-based technology firm Catagen is planning to create 100 jobs over the next two years as it rolls out new green energy products.

The firm specialises in testing catalytic converters for high-end car companies.

It is using underlying technology to develop cheaper and more efficient ways to produce green hydrogen.

Hydrogen is expected to be important in replacing diesel as a fuel for large vehicles and in industrial processes.

Earlier this year, the firm won funding from the government's Net Zero Innovation Portfolio to help accelerate research and testing of its range of net zero products.

Using that funding it has developed new ways to generate green hydrogen, bio-hydrogen and e-fuels, as well as complementary systems for carbon capture and hydrogen compression.
'Real ingenuity'

Those technologies are now at prototype stage and the firm aims to have full-scale demonstrators operating by 2024.

Catagen's chief technology officer, Prof Roy Douglas, said his team has ""has shown real ingenuity to develop these prototypes and put us on a dedicated path to delivering industrial-scale system solutions"".

""We are seeing tremendous demand for these innovations across manufacturing, electricity, agriculture and transportation but there are steps still to take to make our climate technology system a mass deployed commercial reality.""

The firm is also working with the County Fermanagh-based building products firm, Mannok.

The manufacture of building products like cement is very energy intensive and will be challenging to reduce carbon emissions from that sector.

Kevin Lunney, operations director of Mannok Build, said the firm has commissioned Catagen to develop a feasibility study to understand the benefits of integrating its hydrogen and e-fuel production techniques, using waste heat from the cement manufacturing process to reduce emissions. "
"72","Lasers, drones and AI: The future of weeding","https://www.bbc.com/news/business-64742513","Monday, February 27, 2023","David Silverberg","No-one likes weeding, but new technology is helping farmers around the world tackle weeds in a more efficient and environmentally friendly way.

Deanna Kovar from US farming equipment giant John Deere says that the company's new tractor-pulled weed sprayer can reduce herbicide use by two thirds.

The system, called See & Spray Ultimate, looks like a typical field sprayer, in that two long arms or ""booms"" stick out either side of the tractor, with spraying nozzles dotted along the underside of each.

What makes this sprayer far more high-tech, is that it is fitted with 36 cameras. These constantly scan the plants in front of them, instantly identifying what is a crop and what is a weed.

Controlled by an artificial intelligence (AI) software system, the connected sprinklers then only spray herbicide onto the individual weeds rather than drenching the entire field. ""Our system is capturing two million pixels per second, so it is seeing and processing a lot,"" says Ms Kovar, who is vice president of Production and Precision Agriculture Production Systems at John Deere.

To help the software identify the weeds, there are more than 300,000 images on a John Deere database.

The system currently works with three crops - corn, soybean and cotton - and is so far only available in the US.

For farmers elsewhere in the world, a number of rival firms, both large and small, have developed similar smart-weeding technologies. These include German company Bosch BASF Smart Farming, whose camera-scanning weeder is called Smart Spraying Solution."
