"No","Title","Url","date_published","author","content"
"25","Agritech Special Edition","https://www.bbc.com/audio/play/w3ct31zj","Tuesday, January 03, 2023","Ania Lichtarowicz and Alun Beach","This week and to start the New Year we take a look at the use of technology in agriculture around the world. Agriculture as an industry is keen to clean up its act on emissions, so what could be better than an electric tractor. But will it be able to manage all that farming throws at it? Gareth puts the questions to Praveen Penmetsa who is co-founder and CEO of Monarch Tractors which recently launched a ‘Smart Tractor’.

It’s no use having a tractor smart or not, if your crop has been devastated by insects. Pests destroy up to 40 percent of global crops and cost 220 billion US dollars of losses worldwide annually, according to The Food and Agriculture Organization of the United Nations, the FAO. Matej Stefancic the Chief Executive Officer of Trapview a Slovenian company, has developed intelligent insect traps. He explains to Gareth how they monitor bugs in the field, in an effort to cut the need for indiscriminate use of insecticides.

And once you’ve grown your crop you need to harvest it, and in the case of soft fruit it needs careful picking and packing for the market. With a shortage of skilled labour around the world a robot picker capable of matching a human would be ideal. Well, one developed in Britain is currently doing just that on a farm in Portugal, and fruit picked by it could be on sale in supermarkets very soon. The academic founder and Chief Science Officer of Fieldwork Robotics Martin Stoelen is the brains behind this robot and he explains to Gareth the challenges involved in developing it."
"26","The farm where every day is a perfect summer's day","https://www.bbc.com/news/articles/ced2172vzq8o","Tuesday, May 13, 2025","Patrick O'Hagan","With climate change making life increasingly difficult for some farmers, and rising political tensions around the world often disrupting the food supply chain, a Berkshire company is looking at how we can become more self-sufficient.

The Innovation Agritech Group is growing crops indoors 365 days a year.

Hard to grow in the British climate, basil, coriander and lettuce leaves are being nurtured on a series of 16ft by 16ft (5m by 5m) vertical panels.

Italy this is not, but, at IAG's indoor farm in Bracknell, the agricultural technology company is looking at providing herbs and foods in the UK all year round. Farmers fear what a prolonged dry spell will mean for harvests later this year. Last year, England suffered its second worst on record.

When not looking after her 300 cattle on her farm near Swindon, Wiltshire, Liz Webster heads up the Save British Farming campaign group.

She said the changing climate is a huge challenge to her industry.

Government policies in recent years have prioritised the environment over food production, she said, adding: ""We have exposed ourselves to a huge deluge of imports, which is destroying our home production and that's plainly ludicrous.""  Experts such as the University of Reading's Prof Richard Tiffin have said while the UK does import huge quantities of fruit and vegetables, it is more self-sufficient than most, at least when it comes to the basics.

The director of science said it was a different story when it comes to soft fruits and more exotic vegetables.

""We're about 75% self-sufficient when it comes to things we can produce domestically. In fruit, we're probably around 15% self-sufficient,"" he said.

""However, the last thing you want is to be 100% self-sufficient. Not only is it extremely difficult to achieve but that also means you're at the behest of the weather in your own country."" He said we could take a leaf from the Netherlands' book.

The Dutch are masters of growing the most fragile of fruits and herbs indoors, in tightly controlled environments, he said.

""They're a relatively small land country and it's undoubtedly the case the government has invested heavily in some of these indoor production facilities and we're probably behind that,"" said Prof Tiffin.

""They're a role model we should be following."" In Bracknell, IAG is taking the weather and climate change out of the equation, creating an indoor farm where every day is a perfect summer's day

The lighting system mimics the rise and fall of the sun, with the light each plant gets tweaked to suit the species' individual preference.

IAG's commercial director Dean Barron said plants in most indoor farms sit in water trays using a system called hydroponics

But IAG is planting individual seedlings in coir plugs, where minimal water is used.

He said: ""We use a system called aeroponics because we believe that getting oxygen to the roots is a lot better than having it stood in water.""

The system uses 95% less water than standard agriculture and 30-35% less than hydroponic processes, said Mr Barron. Growing everything this way means they are also immune from outside events like the war in Ukraine or the flash floods which hit parts of Spain last autumn, destroying thousands of hectares of fruit and vegetables.

""We can grow in here 365 days a year. Border closures don't then come into play so we won't have to rely on imports that way either, whether that be by sea, air or whatever.,"" Mr Barron said. "
"27","How far can vertical farming go?","https://www.bbc.com/future/article/20230106-what-if-all-our-food-was-grown-in-indoor-vertical-farms","Thursday, January 12, 2023","William Park","Vertical farming promises a future in which our food is grown in pockets of spaces in our cities and beneath our feet. But how far can it really go?

When the Pasona Urban Farm opened in the nine-storey office of a Japanese recruitment company in 2010, it promised a future in which food was grown within feet of the people who would eat it.

Tomatoes hung down from meeting-room light fittings, a rice paddy filled a large conference space, and mushrooms grew in drawers hidden discreetly under benches. The office looked more like a museum of farming than a place of work.

While the modern concept of vertical farming – growing food in trays or pipes stacked on top of one another like a giant plant lasagne – dates from around the 1990s, it could be argued that farmers have sought ways to grow more in less space and with less soil for centuries. Step-over fruit trees – usually apple and pear trees – are grown as low as 1ft (30cm) off the ground and spread laterally to fill thin strips of space in allotments and orchards. The step-over technique is based on espalier training, which might date back to Ancient Roman grape cultivation. But vertical farming in the modern sense is now spreading rapidly. One example is the vertically farmed strawberry brand Oishii, based in New Jersey. In 2021, a punnet of its coveted Japanese Omakase strawberries retailed for $50 (£44) in a high-end New York supermarket. For some, this was evidence that with time vertical farming could rival and ultimately exceed traditional farming for quality. For others, the outlandish price highlighted the huge challenge to make vertical farms commercially viable.

While the technology shows much promise, the costs in both money and energy are still high. This means leafy salads, smaller vegetables and fruits such as tomatoes and strawberries – high value crops which grow quickly – are about the limit of what is currently available commercially from vertical farms.

But where exactly is the limit of what we can actually grow in a vertical farm? And if we did find a way to overcome the problems of cost and energy use, what would a world where all our food is grown in such farms look like? Could we ever move to completely soil-free farming? Farming upwards There is no strict definition of what a vertical farm is, but they typically consist of shallow trays stacked within a building, lit with LED lighting at each level. Many vertical farms have no windows and some are even built underground.

These kinds of farms must supply everything – water, nutrients, sunlight and possibly pollinators and pest control too. Others might be built in massive greenhouses – making the most of the Sun's light and heat, but still controlling other inputs like water. While sometimes soil is used, increasingly vertical farms use hydroponic or aeroponic systems, where water (for hydroponics) or water vapour (for aeroponics) infused with nutrients is circulated directly around the roots of the plant.

""The water efficiency and nutrient efficiency is really quite high in hydroponics and aeroponics because the roots are able to get those nutrients and water in a lot quicker,"" says Laura Vickers, a plant biologist and head of the Urban Farming Group at Harper Adams University in the UK. ""There's no organic matter, there's nothing else for the plant to compete with or to extract the water from."" This means using vertical farms can considerably reduce both the water and fertilisers needed to grow food. Meanwhile, the closed-off, controlled environment of vertical farms can help to stop pests getting in – in turn possibly reducing the need for pesticides.  

The technology can also allow crops to grow in locations where conventional farming is not possible. Astronauts on the International Space Station, for example, are growing their own food in soilless systems under LED lights – with cabbage, mizuna mustard, lettuce and kale among the crops on the menu.

More generally, though, the small amount of land needed for vertical farms means food can be grown near to cities, says Natalia Falagan, an engineer from Cranfield University in the UK, which could give huge benefits. Shorter supply chains could improve both food security and the quality of food, since the faster food reaches us, the less its nutrients deteriorate and the less unseen toxins, such as mycotoxins, develop. It would also result in far fewer food miles than many imported alternatives and help to guarantee the provenance of crops, she says, while also reducing the burden on natural resources like soil, water and the atmosphere. What's more, with advanced plant science, the crops could be engineered to be healthier and tastier, she adds. Having vertical farms in the midst of cities could also help to make us more aware of how our food is produced, says Falagan. Pasona Urban Farm, for example, wasn't just for show – it allowed office workers to harvest their own food at work, which the company hoped would improve both their mental and physical health. Falagan says that having a closer connection with where our food comes from might encourage consumers to be more careful with food waste, too. ""If people know how much goes into producing our food,"" she says, ""then maybe they will think twice about throwing it out."" Most vertical farms currently concentrate on low-biomass crops – things like herbs, salads and small fruits and vegetables which weigh less per portion – because there is a greater yield for the amount of heat, light and water that needs to be supplied. They also have short life cycles, so make maximum use of space, says Vickers. A leafy green will grow quickly and be ready to harvest in days or weeks, whereas a pumpkin would take months to grow and needs to cure in sunlight. A meta-analysis of urban farming in a variety of settings across 53 countries found lettuces, kale and broccoli were particularly suited to vertical farms. Crops like spinach can be grown from seed to harvest in 30 days, meaning a vertical farmer could have 12 harvests from the same tray each year. What's more, if the farmer were to stagger planting their crop from one row of trays to the next, they could have an almost continuous supply of food all year round from their farm – something a traditional farmer can only dream of."
"28","British Sugar given £7.5m to help cut carbon emissions","https://www.bbc.com/news/articles/cvg7jgvzq0do","Friday, May 30, 2025","Neve Gordon-Farleigh","British Sugar has been given £7.5m in funding to help overhaul crop drying processes with the aim of cutting carbon emissions by 25%.

The company, which operates a factory in Wissington, Norfolk, plans to use the money to install emission-cutting technology including heat pumps and carbon capture.

The government funding is part of a £37m project to revolutionise the on-site drying process with gas dryers replaced by steam dryers to save 193,000 MWh a year in energy usage.

Terry Jermy, Labour MP for South West Norfolk, said: ""This is excellent news as British Sugar is a pillar of our country and region with regards to production and innovation The company needs to clean, shred, boil and process the beet crop into different grades of sugar for food and confectionary manufacturers.  Phil McNaughton, head of decarbonisation at British Sugar, said the project would ""not be possible"" without the funding.

He said the change was a ""significant milestone"" in the company's aim of achieving a net zero operation.

""We look forward to working together with the government in the future to utilise new technologies and continue decarbonising our operations.""

In recent years British Sugar has also invested in an evaporation plant at the Wissington factory.

It was awarded the money as part of the Industrial Energy Transformation Fund.

The government hopes the investment will help to cut carbon emissions and improve the efficiency of operations while supporting local jobs and economic growth.  "
"29","What does the new EU deal mean for Scotland?","https://www.bbc.com/news/articles/cd7gvzpj0r2o","Tuesday, May 20, 2025","Katy Scott","The new EU deal has been described in Scotland as both a ""betrayal"" and ""breakthrough"", and will affect businesses in different ways.

The harshest criticism has come from the commercial sea fishing industry which has reacted angrily to a 12-year extension of the initial post-Brexit fishing agreement.

But the clearing away of red tape could also benefit exports for others in the sector.

So what does the new deal mean for Scotland?  Fishing

The previous post-Brexit deal saw the UK regain 25% of fishing rights from the EU, but it also gave European boats continued access to UK waters.

It was due to expire at the end of June 2026 but the new agreement will see that extended until the summer of 2038.

Elspeth Macdonald, who represents more than 400 fishing boats as chief executive of the Scottish Fishermen's Federation, told BBC Scotland it was a ""total capitulation to the EU"".

By agreeing to a multi-year deal, she argues, the UK has thrown away an important bargaining chip for future negotiations.

Deputy First Minister Kate Forbes described it as a ""great betrayal"" of Scotland's fishing fleet.

But the UK government claims the deal provides more certainty and stability going forward, and there will be no increase in the EU quota.

Reduced bureaucracy could benefit west coast creel fisherman who sell directly into Europe and benefit from measures to reduce hold-ups for goods that perish quickly.

Shellfish from some UK waters, currently banned in the EU, can be exported again under the deal.

In an effort to address concerns from the fishing sector, the UK government has also announced a £360m fishing and coastal growth fund to invest in new technology, equipment and support for coastal communities. Agriculture

A new SPS agreement will make food and drink imports and exports between the UK and the EU easier. SPS stands for sanitary and phytosanitary, which refers to rules about animals and food.

The deal will align UK food safety and animal health standards with those of the EU, meaning most routine checks on animal and plant products will be removed completely.

Prime Minister Sir Keir Starmer said it would reduce ""red tape"" for businesses and help cut lorry queues at the border.

The UK government said this could lead to lower food prices and more choice on supermarket shelves.

The deal also means that British farms will be able to sell sausages and burgers to the EU for the first time in five years.

It would also return Scottish seed potatoes, once an important export, to the EU market after they were banned in 2021 in the wake of Brexit. President of the National Farmers Union (NFU) in Scotland Andrew Connon told BBC Scotland's Lunchtime Live programme he was ""cautiously optimistic"".

He said it would help the livestock sector, specifically beef and lamb producers, as well as the seed potato industry which had suffered in recent years.

""Since Brexit, there has been more restriction and more friction at borders with regards to exports,"" he said.

""The likes of the seed potato industry has been massively impacted. So anything that can reduce that friction has to be welcomed.""

But Mr Connon also said it was important that standards were not relaxed and the border was kept safe so not to undermine British markets. "
"30","Women farmers making their mark in agriculture","https://www.bbc.com/news/articles/c70wgw2vgw5o","Monday, March 24, 2025","Hsin-Yi Lo","Women farmers in the South East have highlighted the changes within the industry in the past 20 years.

Liz Wallis, who runs the 220-acre Twyford Farm in West Sussex with her husband Bob, oversees 200 ewes.

The 69-year-old said when she turned 18, she travelled to New Zealand to work at a farm.

""Farming is in my blood. I'm the third generation of women farming in my family. Both my grandmother and mother were widowed young,"" she said. ""When I first started farm work, at the time, it was a male-dominated field. Women were in farming, but they were restricted to less physically-demanding jobs like looking after baby animals and milking.""
Developing new methods

Ms Wallis said the industry began to change at the turn of the millennium when farming became more ""mechanised"".

She said technology such as tractors, as well as temperature and moisture sensors, had helped bridge the gender gap in the industry.

She added: ""As technology started to play a stronger role in farming, this meant you didn't require a lot of physical strength to carry out tasks.""

Ms Wallis said women farmers had developed methods that require less physicality and strength to complete their jobs. Meanwhile, Kayleigh Robb has been running the 200-acre Pierrepont Farm in Farnham, Surrey, since April last year.

She said she was excited to be a part of a generation of women farmers who were promoting regenerative farming, a method which allows soil, nutrients and water to regenerate themselves.

She said while it was ""challenging"", she had big plans to transform the farm.

""I'm excited about the future,"" she said.

""I can already envision how the farm will evolve and play a greater role in the surrounding ecosystem and habitat."" "
"31","Why Vermont farmers are using urine on their crops","https://www.bbc.com/future/article/20250227-the-vermont-farmers-using-urine-to-grow-their-crops","Saturday, March 01, 2025","Becca Warner","Urine was used as fertiliser in ancient Rome and China. Now farmers in Vermont are bringing this practice back to boost harvests and grow crops in a more sustainable way.

When Betsy Williams goes to the loo, she likes to know her pee won't go to waste. For the last 12 years, she and her neighbours in rural Vermont, US, have diligently collected their urine and donated it to farmers for use as fertiliser for their crops.

""We're consuming all of these things that have nutrients in them, and then a lot of the nutrients that are passing through us can then get recycled back into helping create food for us and for animals. So to me, it's logical,"" Williams says.

Williams takes part in the Urine Nutrient Reclamation Program (UNRP), a programme run by the Rich Earth Institute (REI), a non-profit based in Vermont. She and 250 of her neighbours in Windham County donate a total of 12,000 gallons (45,400 litres) of urine to the programme each year to be recycled – or ""peecycled"". 

Windham County's pee-donations are collected by a lorry and driven to a large tank where the urine is pasteurised by heating it to 80C (176F) for 90 seconds. It is then stored in a pasteurised tank, ready to be sprayed on local farmland when the time is right to fertilise crops. Records suggest that urine was used to help grow crops back in ancient China and ancient Rome. Today, scientists are finding that it can more than double the yield of crops like kale and spinach compared to no fertiliser, and improve yields even in low fertility soils.

Urine's power as a fertiliser is due to the nitrogen and phosphorus that it contains – the same nutrients that are added to the synthetic fertilisers used on many conventional farms. But these synthetic fertilisers come at an environmental cost. Nitrogen is produced using the fossil fuel-intensive Haber-Bosch process, and the mining of phosphorus creates harmful amounts of toxic waste. Urine, meanwhile, is freely available – as Williams puts it, ""everybody pees. [It's an] untapped resource"".
Rich Earth Institute Urine's power as a fertiliser is due to the nitrogen and phosphorus that it contains (Credit: Rich Earth Institute) Nancy Love, a professor of civil and environmental engineering at the University of Michigan who has collaborated with the team at REI over the last decade, has found that using urine instead of standard synthetic fertiliser reduces greenhouse gas emissions, and requires around half the amount of water. Indeed, since 2012, UNRP estimates that it has conserved over 2.7 million gallons (10.2 million litres) of water through preventing toilet flushes.

""I've always been a systems thinker, and our [water] system has inefficiencies in it,"" Love says. ""What we do today is dilute the hell out of our urine, we put it in a pipe, we send it to a treatment plant, and then we pump a bunch more energy into it, just to send it back into the environment in a reactive form."" In the case of urine's nutrients, its typical destination is waterways. The nitrogen and phosphorus in urine are not fully removed from wastewater when it is treated. When these nutrients find their way into rivers and lakes, they are taken up by algae. The result can be algal blooms that choke up waterways, unbalancing the ecosystem and killing other species that live there.

""Our bodies create a lot of nutrients, and right now those nutrients are not only wasted, but they’re actually causing a lot of problems and harm downstream,"" says Jamina Shupack, REI's executive director.

These nutrients are food for algae – but also for crops. ""Wherever you put nitrogen, it's going to help plants grow. So if it's in the water, it's helping the algae grow. But if it's on the land, it's going to help plants grow,” Shupack explains. Because of this, diverting nutrient-rich urine away from waterways and onto the land can prevent harmful algal blooms while helping farmers grow food. Importantly, the REI team and the farmers they work with take steps to minimise how much of the urine runs off the land and into waterways. Application is carefully timed, so that it happens when the plant is most able to take up the nutrients – typically during the plant's more active growth stage, when it's bigger than a seedling but not yet fruiting. The soil moisture is also measured, to make sure the liquid urine will be absorbed. Despite these efforts, ""that doesn't mean that there isn't going to be runoff"", Shupack says.  Even so, she adds, peecycling reduces the overall amount of nutrients entering waterways because it ensures that runoff from the land is the only way excess nutrients enter rivers and lakes. In the current system, synthetic fertilisers run off into waterways, as well as urine entering rivers directly via wastewater.

The UNRP in Vermont is pioneering peecycling in the US, but projects in other countries are also underway. In Paris, volunteers are collecting urine to help save the River Seine and fertilise wheat for baguettes and biscuits. Swedish entrepreneurs saw the harm caused by algal blooms around the island of Gotland and came up with a product that collects urine and turns it into fertiliser. Peecycling pilots have also run in South Africa, Nepal and Niger Republic. "
