"No","Title","Url","date_published","author","content"
"1","Frugal tech: The start-ups working on cheap innovation","https://www.bbc.com/news/articles/c20xlqn0e5po","Tuesday, May 27, 2025","Devina Gupta","For Mansukh Prajapati, childhood in the western Indian city of Morbi began before sunrise, with a six-mile walk to collect clay for their family business.

""My father was a potter,"" he recalls.

Often he would wake up to the rhythmic sound of his father at work at his potter's wheel.

""My mother and I would get up at four in the morning and walk for miles every day to get clay.""

Used for storing water, clay pots were a common item in Indian households in the 1970s.

But the income from making pots was meagre and the profession also came with social stigma.

""Nobody wanted to their daughter married in a potter's family,"" Mr Prajapati says. ""They feared she will be burdened with endless labour."" Aged 31, a natural disaster marked the turning point for Mr Prajapati.

The devastating earthquake that hit Gujarat in 2001 destroyed his family home and left a pile of smashed clay pots in the courtyard.

""A local reporter wrote that 'the poor people's fridge is broken',"" Mr Prajapati says.

""Clay pots keep water cool in the summer, so they are just like a fridge. The thought got stuck in my head. So, I decided to make a fridge out of clay that doesn't need electricity.""

With no formal training, Mr Prajapati started experimenting with designs and materials.

""I first tried to make it like the modern fridge and even added a water tank, but nothing worked', he says.

""At one point I had $22,000 (£17,000) in loans and had to sell my house and small workshop. But I knew I had to keep going.""

It took four years of tinkering to come up with a design that worked - a small clay cabinet with a water talk on the top and storage shelves below.

As water trickles through the cabinet's porous clay walls, it naturally cools the interior.

Mr Prajapati says it can keep fruit and vegetables fresh for at least five days - no electricity needed.

He named it MittiCool or the clay that stays cool.

At $95 its affordable and now sold through 300 stores in India and exported to countries including the UK, Kenya, and UAE.

""Fridges are a dream for many poor families,"" Mr Prajapati says. ""And such dreams should be within reach."" Mr Prajapati's innovation is part of a growing wave of grassroots entrepreneurship in India, driven by necessity.

Prof Anil Gupta who runs the Honeybee Network, a platform for supporting such ventures, call these ""frugal innovations"".

""It is a mindset,"" says Prof Gupta.

""Frugal innovation is about making solutions affordable, accessible, and available. Many of these innovators don't have formal education but are solving real world problems.""

It's difficult to put a number on such businesses, as there has never been an in-depth study.

Prof Gupta says such start-ups are crucial because they provide jobs in rural areas and start a cycle of economic change.

For example, Mr Prajapati now employs 150 people in his workshop and has branched out into cookware, clay water filters and is experimenting with homes made of clay. Another start-up that's hoping for similar success, is run by Bijayshanti Tongbram in the northeastern state of Manipur.

She lives in Thanga village which is home to one of India's largest freshwater lakes, Loktak.

Here lotus flowers bloom in abundance.

""People in my village use the petals of lotus flowers for religious offerings. But their stems often go to waste and that's what I wanted to change and thought of doing something sustainable,"" she says.

A botanist by profession, Ms Tongbram developed a way to extract silk-like fibres from the lotus stems and now leads a team of 30 women in her village who spin the threads into a yarn and weaves them into unique scarves and garments.

""It takes two months, and 9,000 lotus stems to make one scarf,"" she says.

Ms Tongbram pays the women $80 a month.

""This isn't just about fashion. I am giving women in my village a chance to do something other than fishing and earn money,"" she says.

Like many small business owners, she wants to scale-up and find new markets, perhaps overseas.

""Funding is the biggest challenge,"" she says."
"2","Farmers 'making a change' to cut carbon emissions","https://www.bbc.com/news/articles/c626ln7j2x4o","Thursday, June 05, 2025","Kirk England","A South West farmer said many in the industry were ""embracing the challenge"" of working more sustainably.

Jonathan Smith, who farms on the Isles of Scilly and works with other farmers and growers to reduce their carbon footprint, said ""weather patterns are changing"", and farmers needed to ""both reduce emissions and adapt to a changing climate as well"".

It follows the UK experiencing the warmest spring on record and predictions of a hotter-than-normal summer, with an increased chance for heatwaves.

The Department for Environment, Food and Rural Affairs (Defra) said it was investing £5bn into farming, adding its ""commitment to farmers and growers remains steadfast."" ""All the fruit, vegetables and herbs we grow are sold within the islands"" said Mr Smith, who has run his organic horticultural business on St Martin's since 2003.

Mr Smith added: ""We minimise the use of tractors and limit materials such as plastic. We use seaweed, compost and green manures to fertilise the fields.

""We also plant and maintain trees, hedges and an orchard to help sequester carbon and boost biodiversity.""

Mr Smith said his business absorbed more carbon than it emitted. Farm Net Zero

Andrew Brewer is a part of the Farm Net Zero project, which is working with farms across Cornwall to show the contribution agriculture makes to reducing greenhouse gas emissions.

""We used to buy a lorry load of fertiliser every month but we've not bought any now for five years. We make better use of our slurries and manure from our animals"", Mr Brewer said.

He added: ""We're reducing our carbon footprint significantly"".

Farming is responsible for around 12% of the UK's total greenhouse gas emissions, according to the government.

The UK also has a legally-binding target, under the Climate Change Act, to be net zero by 2050.

In March 2025, concerns were raised by the National Farmers Union (NFU) over the impact of the sudden closure of the government's Sustainable Farming Initiative (SFI).

The payment scheme was put in place to encourage farmers to carry out environmental work on their land.  'Climate-smart food production'

A spokesperson for the NFU said: ""The wet weather of the past two years and driest spring for a generation have had noticeable effects on farm assets and productivity, which is why we need to develop a strategic, multifunctional and coherent land use strategy focused on resource-efficient, climate-smart food production.

""Everything comes back to sufficient funding.""

It added: ""We need an agricultural budget which allows more farm businesses to take these important measures through the Sustainable Farming Incentive, and a nationwide flooding investment plan, which recognises rural needs, to make the UK more resilient to any extreme weather that comes our way."" 'Investing record amounts'

A Defra spokesperson said: ""Our commitment to farmers and growers remains steadfast.

""That's why this government is investing £5 billion into farming and has appointed former NFU president Baroness Minette Batters to recommend new reforms to boost farmers profits.

""We are also investing record amounts in flood defences and have helped secure funding for nine new reservoirs."""
"3","The cows wearing smart collars to measure activity","https://www.bbc.com/news/articles/czj31jwlx4xo","Wednesday, February 05, 2025","Louise Cullen","From monitoring animal activity to predicting the best time for insemination to support genetic improvement, apps are playing an increasing role in farming and reducing its impact on the environment.

Modern technology has transformed Hugh Harbison's family farm in Aghadowey in County Londonderry.

His cows wear electronic collars so he can monitor how active they are and when his best producers are ready for insemination.

For Hugh it's about being both ""profitable, and sustainable as well"". Farmers say they'll need help to play their part in achieving targets like a 48% reduction in overall emissions.

Hugh got involved when he got ""fed up with farmers copping a lot of flak"" about their emissions.

Agriculture is responsible for the largest share of Northern Ireland's greenhouse gases.

That includes methane from cattle, which is a significantly more potent GHG than carbon, having a greater impact in its shorter life.

There are more than 3,000 dairy farms in Northern Ireland and the dairy sector is a significant economic player in agriculture.

Managing emissions from these cattle is key to tackling their environmental impact.

That means improving efficiency in the herd - the same number of animals producing more and better milk.
Better milk

Increasing that efficiency is a complex process though, involving analysis of the grass and feed the cows eat and scientifically monitoring their output.

Among the changes Hugh brought in after taking over Ballydevitt farm in 2012 was joining the ARC Zero project, which opened his eyes to the role the environment was playing in his farm management. The whole farm was surveyed.

""We did a calculation to work out how much tons of carbon dioxide emissions were emitting from the cows that produce the milk that we produce on this farm and that gives us the baseline then to look at what our nitrous oxide emissions, carbon emissions and methane are, where they're coming from, and how we can improve that?""

The collars the cows wear for monitoring activity mean he is breeding off his best animals all the time to improve his genetic stock.

And it shows in the milk they produce.

""We've increased our fat and protein percentages by over half a percent over the past five years. We've also increased our milk from forage (farm-grown feed) from 2,500 acres to 3,500 acres over that period of time,"" he told BBC News NI.

""So those figures, you know, they make us both financially sustainable and environmentally sustainable as well."" And, he has focused on what his soil can produce to feed his 180-strong dairy herd at Ballydevitt farm, rather than buying in feed and fertiliser that come with both financial and carbon cost.

""We've increased more clover into the swards that the cattle graze, we've tried to increase multi-species swards using plantain and chicory.

""It's a slow burn, it's a learning curve.

""It's not going to change overnight, but I suppose those things are making a drastic change on our environmental and our financial sustainability as well."" Environmental sustainability in dairy farming is the theme of the Dairy Council's annual Sustainable Dairy Conference, taking place on Wednesday.

The Council CEO Ian Stevenson said it goes ""hand in hand"" with social and economic sustainability.

""Worth almost £1.5bn annually, the dairy sector is an important pillar in rural communities throughout Northern Ireland.

""Taking an evidence-based approach to sustainability is key to improving the dairy sector's environmental footprint and lowering emissions, and as we will be hearing during the CAFRE and DAERA Presentations, Northern Ireland is punching above its weight in providing a reliable evidence base for future decision-making and partnership working."""
"4","A new life for empty offices: Growing kale and cucumbers","https://www.bbc.com/future/article/20250127-why-veg-is-growing-in-empty-office-spaces","Tuesday, January 28, 2025","Vittoria Traverso","In some cities, as many as one in four office spaces are vacant. Some start-ups are giving them a second life – as indoor farms growing crops as varied as kale, cucumber and herbs.

Since its 1967 construction, Canada's ""Calgary Tower"", a 190m (623ft) concrete-and-steel observation tower in Calgary, Alberta, has been home to an observation deck, panoramic restaurants and souvenir shops. Last year, it welcomed a different kind of business: a fully functioning indoor farm.

Sprawling across 6,000sq m (65,000 sq ft), the farm, which produces dozens of crops including strawberries, kale and cucumber, is a striking example of the search for city-grown food. But it's hardly alone. From Japan to Singapore to Dubai, vertical indoor farms – where crops can be grown in climate-controlled environments with hydroponics, aquaponics or aeroponics techniques – have been popping up around the world.

While indoor farming had been on the rise for years, a watershed moment came during the Covid-19 pandemic, when disruptions to the food supply chain underscored the need for local solutions. In 2021, $6bn (£4.8bn) in vertical farming deals were registered globally – the peak year for vertical farming investment. As the global economy entered its post-pandemic phase, some high-profile startups like Fifth Season went out of business, and others including Planted Detroit and AeroFarms running into a period of financial difficulty. Some commentators questioned whether a ""vertical farming bubble"" had popped. But a new, post-pandemic trend may give the sector a boost. In countries including Canada and Australia, landlords are struggling to fill vacant office spaces as companies embrace remote and hybrid work. In the US, the office vacancy rate is more than 20%.

""Vertical farms may prove to be a cost-effective way to fill in vacant office buildings,"" says Warren Seay, Jr, a real estate finance partner in the Washington DC offices of US law firm ArentFox Schiff, who authored an article on urban farm reconversions. 

There are other reasons for the interest in urban farms, too. Though supply chains have largely recovered post-Covid-19, other global shocks, including climate change, geopolitical turmoil and farmers' strikes, mean that they continue to be vulnerable – driving more cities to look for local food production options. 

Office-to-farm conversions have made headlines in recent months. Workers are currently aiming to transform a floor of 32-story historic Niels Esperson building in Houston, Texas, into an indoor farm. In September 2024, US indoor farm startup 80 Acres, which opened its first indoor farm inside a vacant building in Hamilton, Ohio, developed a 200,000-sq-ft (18,600-sq-m) facility inside a former commercial building in Florence, Kentucky. 

One obvious use of vacant office space is to convert it to residential housing. But a vertical farm conversion is, perhaps surprisingly, often easier. ""When converting an office space into apartments, you need to carve out individual units, each needing access to natural light and plumbing,"" Seay says. ""That's not an easy task in a building designed for cubicles and conference rooms."" On the other hand, the open-plan nature of most modern offices, or warehouses, can be more amenable to indoor farm use. Still, retrofitting, particularly to ensure a space can fit the proper equipment as well as have appropriate electrical, heating, ventilation and air conditioning (HVC) systems, can be difficult. The Calgary Tower project, developed by the company Agriplay Ventures, has worked to overcome these hurdles. Agriplay uses silo technology, made of 1-by-2.5m (4-by-8ft) wide racks rising up to 3m (10ft) tall, that can easily adapt to any space with ventilation. The modular racks are also easy to remove once a project is done, leaving landlords with the option of converting the premises for different uses, says Agriplay's chief executive Adam Morand.

Thanks to artificial light and controlled temperatures, offices are proving surprisingly good environments for indoor agriculture, spurring some companies to convert part of their facilities into small farms. Since 2022, Australia's start-up Greenspace has worked with clients like Deloitte and Commonwealth Bank to turn ""dead zones"", like the space between lifts and meeting rooms, into 2m (6ft) tall hydroponic cabinets growing leafy greens.

On top of being adaptable to indoor farm operations, vacant office buildings offer the advantage of proximity to final consumers. In a former paper storage warehouse in Arlington, about a mile outside of Washington DC, Jacqueline Potter and the team at Area 2 Farms are growing over 180 organic varieties of lettuce, greens, root vegetables, herbs and micro-greens. By serving consumers 10 miles away or less, the company has driven down transport costs and associated greenhouse emissions.

This also frees the team up to grow other types of food that can be hard to find elsewhere – such as edible flower species like buzz buttons and nasturtium. ""Most crops are now selected to be grown because of their ability to withstand a 1,500-mile journey,"" Potter says, referring to the average distance covered by crops in the US before reaching customers. ""In our farm, we can select crops for other properties like their nutritional value or taste."" Overall, vertical farms have the potential to outperform regular farms on several environmental sustainability metrics like water usage, says Evan Fraser, professor of geography at the University of Guelph in Ontario, Canada and the director of the Arell Food Institute, a research centre on sustainable food production. Most indoor farms report using a tiny fraction of the water that outdoor farms use. Indoor farms also report greater output per square mile than regular farms.

Energy use, however, is the ""Achilles heel"" of this sector, says Fraser: vertical farms need a lot of electricity to run lighting and ventilation systems, smart sensors and automated harvesting technologies. But if energy is sourced from renewable sources, they can outperform regular farms on this metric too, he says.  Because of variations in operational setup, it is hard to make a general assessment of the environmental, social and economic sustainability of indoor farms, says Jiangxiao Qiu, a landscape ecologist at the University of Florida and author of a study on urban agriculture's role in sustainability. Still, he agrees with Fraser: in general, urban indoor farms have higher crop yield per square foot, greater water and nutrient-use efficiency, better resistance to pests and shorter distance to market. Downsides include high energy use due to lighting, ventilation and air conditioning.

They face other challenges, too. As Seay notes, zoning laws often do not allow for agricultural activity within urban areas (although some cities like Arlington, Virginia, and Cincinnati, Ohio, have recently updated zoning to allow indoor farms). And, for now, indoor farms have limited crop range. It is hard to produce staple crops like wheat, corn or rice indoors, says Fraser. Aside from leafy greens, most indoor facilities cannot yet produce other types of crops at scale.

But as long as the post-pandemic trends of remote work and corporate downsizing will last, indoor farms may keep popping up in cities around the world, Seay says. 

""One thing cities dislike more than anything is unused spaces that don't drive economic growth,"" he says. ""If indoor farm conversions in cities like Arlington prove successful, others may follow suit."" "
"5","Intensive farming 'least bad option' for food and environment","https://www.bbc.com/news/science-environment-45520399","Friday, September 14, 2018","Matt McGrath","Intensive, high-yielding agriculture may be the best way to meet growing demand for food while conserving biodiversity, say researchers.

But their study says the approach makes sense only if it is linked to more wilderness being spared the plough.

Intensive farming is said to create high levels of pollution and damage the environment more than organic farming.

However, this report suggests that contrary to perceptions, this is not necessarily the case.

Organic groups though have rejected the report's findings.  Around the world sales of organic produce have boomed over the past 20 years as consumers have bought into the idea that the approach is good not just for their health but for the good of the planet, as well.     Cities lead the way on curbing carbon
    'Single piece of plastic' can kill turtles
    Vapers rise 'to more than three million' 

However, this study takes issue with that view.

The researchers measured the environmental costs - including what they term ""externalities"", such as greenhouse gas emissions, fertiliser and water use - of producing a given amount of food on both high-yield and low-yield farms.  Working with scientists in 17 organisations from around the globe, they analysed information from hundreds of investigations into four large food areas - Asian paddy rice, European wheat, Latin American beef and European dairy.

While the data available is limited, the researchers concluded that many high-yield systems are less damaging to the environment and use less land.

""If we are serious about keeping most of the species with which we share the planet, we are going to have to make the best use of the farmland we've already got rather than continue to expand,"" said lead author Prof Andrew Balmford, from the University of Cambridge.

""And that means we are going to have to get smart about high-yield agriculture.""

The authors say the world needs to reduce consumption of beef and other high-impact foodstuffs if we are to have a sustainable future - but they believe their study shows that producing these materials with less land may be the best way of making space for nature and may also have fewer environmental costs than lower-yielding systems. ""We are certainly not pro conventional agriculture business as usual,"" said Prof Balmford. ""'We're just pro looking at the numbers, and the numbers tell us that most biodiversity can't survive on any sort of farm."" When it comes to organic dairy farming in Europe, the researchers found that for the production of the same volume of milk, organic systems took up twice as much land and caused at least one-third more soil loss than conventional dairy farming.
Fallow fields

""Across all dairy systems we find that higher milk yield per unit of land generally leads to greater biological and economic efficiency of production,"" said co-author Prof Phil Garnsworthy, from the University of Nottingham,

""Dairy farmers should welcome the news that more efficient systems have lower environmental impact."" One key element of this report is the link between intensive farming and leaving more land for wilderness.

The authors say there are various mechanisms that can be put in place to encourage farmers to take land out of production and reward them for the ""public good"" element that their lands provide, such as stemming the flow of floodwater, or absorbing carbon dioxide.

Environment Secretary Michael Gove has made this idea a key element of his proposed reforms for agriculture funding in the UK in the wake of Brexit.

Prof Balmford supports the approach.

""Land owners do produce very significant public goods that the market doesn't reward them for. Using some of the subsidy to do that offers considerable promise.""  Organic group though are not impressed with the study's conclusions. They argue that the world produces enough food already and that the issues with feeding populations are economic and political, not agricultural.

""When the environmental and other damages caused by high energy and chemical inputs in non-organic are factored in - some of which the report's authors did not take into account - the research we've seen to date shows organic farming is more beneficial to society,"" said a spokesman for the UK's Soil Association.

""Organic methods show that it is possible to have long-term sustainable food production and environmental conservation; supporting 50% higher abundance of wildlife than non-organic and higher standards of animal welfare, while improving soil health and supporting soils to capture up to 450kg more carbon per hectare.""

The study has been published in the journal Nature Sustainability."
"6","Smart farming's 'eye in the sky'","www.bbc.com/news/business-41362333+E8","Friday, September 22, 2017","BBC Author","With global population set to top 10 billion by 2050, the UN says agricultural output needs to rise by 70%. And Africa will be key as it is home to two-thirds of the world's uncultivated arable land.

The BBC's Taurai Maduna has been to South Africa's Western Cape to see how drones and data analytics are set to change the game."
